Becamex Bình Dương,Đường 30/4, Đại lộ Bình Dương, TP Thủ Dầu Một, Bình Dương,https://vpf.vn/wp-content/uploads/2018/10/binh-duong-2021.png
Công An Hà Nội,Số 9 Trịnh Hoài Đức, P. Cát Linh, Q. Đống Đa, TP Hà Nội,https://vpf.vn/wp-content/uploads/2018/10/cong-an-ha-noi-fc-300x300.png
Đông Á Thanh Hóa,37 Lê Quý Đôn, Ba Đình, TP Thanh Hóa, Thanh Hóa.,https://vpf.vn/wp-content/uploads/2018/10/Logo-CLB-Dong-A-Thanh-Hoa_chuan-300x249.png
Hà Nội,Số 9 Trịnh Hoài Đức, P. Cát Linh, Q. Đống Đa, TP Hà Nội,https://vpf.vn/wp-content/uploads/2018/10/HNFC-6-sao-300x300.png
Hải Phòng,Số 17 Lạch Tray, Ngô Quyền,Hải Phòng,https://vpf.vn/wp-content/uploads/2018/10/haiphongfc-300x291.jpg
LPBank Hoàng Anh Gia Lai,22 Quang Trung, đường Tây Sơn, Pleiku, Gia Lai,https://vpf.vn/wp-content/uploads/2018/10/HAGL.jpg
Hồng Lĩnh Hà Tĩnh,Số 5 đường Nguyễn Biểu, P.Nam Hà, Hà Tĩnh,https://vpf.vn/wp-content/uploads/2018/10/Logo-Ha-Tinh-update.png
Khánh Hòa,Đường Yersin, Vạn Thạnh, TP Nha Trang, Khánh Hòa,https://vpf.vn/wp-content/uploads/2018/12/Khanh-Hoa-FC.png
Quảng Nam,Tổ 8 phường Hòa Hưng, TP Tam Kỳ, Quảng Nam,https://vpf.vn/wp-content/uploads/2018/10/Quang-Nam.jpg
MerryLand Quy Nhơn Bình Định,236B Lê Hồng Phong - TP Quy Nhơn,https://vpf.vn/wp-content/uploads/2018/10/Binh-Dinh-300x300.png
Sông Lam Nghệ An,số 6 Đào Tấn, Tp Vinh, Nghệ An,https://vpf.vn/wp-content/uploads/2018/10/slna-233x300.png
Thép Xanh Nam Định,Số 5 Đặng Xuân Thiều, phường Vị Hoàng, TP Nam Định, Nam Định,https://vpf.vn/wp-content/uploads/2018/10/Nam-Dinh.jpg
TP Hồ Chí Minh,30 Nguyễn Kim, P6, Q10, TPHCM,https://vpf.vn/wp-content/uploads/2018/10/HCM-FC-2023-300x300.png
Thể Công – Viettel,Số 9 Trịnh Hoài Đức, P. Cát Linh, Q. Đống Đa, TP Hà Nội,https://vpf.vn/wp-content/uploads/2018/10/Logo-The-Cong-Viettel-300x300.jpg
